{"datasetId":"dragonstar-25.05","places":[{"entrances":[{"coordinate":[-888915.562,65824.0],"exteriorCell":[-109,8],"id":"dragonstar-25.05.entrance-8683427e6bbabd946b2d","sourcePlugin":"Sky_Main.esm","sourceRef":"0x0000e46b"}],"exteriorCell":[-109,8],"id":"dragonstar-25.05.place-0047a57cf0c618c65f82","mapPosition":[-888915.562,65824.0],"mimCategory":null,"minZoom":4,"regionId":"skyrim","sources":[{"kind":"esm","mimIndex":null,"plugin":"Sky_Main.esm","recordId":"Mirilstern, Pallatium"}],"type":"other"},{"entrances":[{"coordinate":[-850755.562,47952.453],"exteriorCell":[-104,5],"id":"dragonstar-25.05.entrance-35e1fd68e03253a94c3a","sourcePlugin":"Sky_Main.esm","sourceRef":"0x00000cba"},{"coordinate":[-850883.125,47266.516],"exteriorCell":[-104,5],"id":"dragonstar-25.05.entrance-619ff191b9b96f81a184","sourcePlugin":"Sky_Main.esm","sourceRef":"0x00000ccc"}],"exteriorCell":[-104,5],"id":"dragonstar-25.05.place-005efb6a8985beb3a1ff","mapPosition":[-850755.562,47952.453],"mimCategory":null,"minZoom":4,"regionId":"skyrim","sources":[{"kind":"esm","mimIndex":null,"plugin":"Sky_Main.esm","recordId":"Karthwasten, Vancor: Fine Colovian Smithing"}],"type":"other"},{"entrances":[{"coordinate":[-919984.0,114072.0],"exteriorCell":[-113,13],"id":"dragonstar-25.05.entrance-2c729b1c721e21821c54","sourcePlugin":"Sky_Main.esm","sourceRef":"0x0003a3ce"},{"coordinate":[-920208.0,114616.0],"exteriorCell":[-113,13],"id":"dragonstar-25.05.entrance-38677ee971e848ee2271","sourcePlugin":"Sky_Main.esm","sourceRef":"0x0003a3cf"}],"exteriorCell":[-113,13],"id":"dragonstar-25.05.place-006e50769ac851e77da5","mapPosition":[-919984.0,114072.0],"mimCategory":null,"minZoom":3,"regionId":"skyrim","sources":[{"kind":"esm","mimIndex":null,"plugin":"Sky_Main.esm","recordId":"Dragonstar East, Castle Dragonstar: Upper Quarters"}],"type":"stronghold"},{"entrances":[{"coordinate":[-924208.0,104464.0],"exteriorCell":[-113,12],"id":"dragonstar-25.05.entrance-207fe7848c90dac65a6d","sourcePlugin":"Sky_Main.esm","sourceRef":"0x00048e86"}],"exteriorCell":[-113,12],"id":"dragonstar-25.05.place-00a122e69bcec8fe9b83","mapPosition":[-924208.0,104464.0],"mimCategory":null,"minZoom":4,"regionId":"skyrim","sources":[{"kind":"esm","mimIndex":null,"plugin":"Sky_Main.esm","recordId":"Dragonstar East, Erkild's House"}],"type":"house"},{"entrances":[{"coordinate":[-925341.688,108339.258],"exteriorCell":[-113,13],"id":"dragonstar-25.05.entrance-e2603bcd305f5bcb53b5","sourcePlugin":"Sky_Main.esm","sourceRef":"0x0003a3c8"}],"exteriorCell":[-113,13],"id":"dragonstar-25.05.place-0166db6a6536e7f7f36a","mapPosition":[-925341.688,108339.258],"mimCategory":null,"minZoom":4,"regionId":"skyrim","sources":[{"kind":"esm","mimIndex":null,"plugin":"Sky_Main.esm","recordId":"Dragonstar East, Aygme's House"}],"type":"house"},{"entrances":[{"coordinate":[-930634.312,101883.484],"exteriorCell":[-114,12],"id":"dragonstar-25.05.entrance-36adb5adda1e4106731b","sourcePlugin":"Sky_Main.esm","sourceRef":"0x000485a7"}],"exteriorCell":[-114,12],"id":"dragonstar-25.05.place-01dc7ba5512495476852","mapPosition":[-930634.312,101883.484],"mimCategory":null,"minZoom":4,"regionId":"skyrim","sources":[{"kind":"esm","mimIndex":null,"plugin":"Sky_Main.esm","recordId":"Dragonstar West, Tivara Clothgen's House"}],"type":"house"},{"entrances":[{"coordinate":[-932982.125,102340.641],"exteriorCell":[-114,12],"id":"dragonstar-25.05.entrance-3001a85d0e38dac4c6aa","sourcePlugin":"Sky_Main.esm","sourceRef":"0x000485a6"}],"exteriorCell":[-114,12],"id":"dragonstar-25.05.place-02eae82835de224824c6","mapPosition":[-932982.125,102340.641],"mimCategory":null,"minZoom":4,"regionId":"skyrim","sources":[{"kind":"esm","mimIndex":null,"plugin":"Sky_Main.esm","recordId":"Dragonstar West, Arhad's House"}],"type":"house"},{"entrances":[{"coordinate":[-859175.0,49356.719],"exteriorCell":[-105,6],"id":"dragonstar-25.05.entrance-cd6cf2decf87665735d7","sourcePlugin":"Sky_Main.esm","sourceRef":"0x00024532"}],"exteriorCell":[-105,6],"id":"dragonstar-25.05.place-0511344b07ca801a9825","mapPosition":[-859175.0,49356.719],"mimCategory":null,"minZoom":4,"regionId":"skyrim","sources":[{"kind":"esm","mimIndex":null,"plugin":"Sky_Main.esm","recordId":"Karthwasten, Lesleen's House"}],"type":"house"},{"entrances":[{"coordinate":[-921830.125,105217.484],"exteriorCell":[-113,12],"id":"dragonstar-25.05.entrance-dbecf07acf2530b496a8","sourcePlugin":"Sky_Main.esm","sourceRef":"0x00048e95"}],"exteriorCell":[-113,12],"id":"dragonstar-25.05.place-05fd39ce41bb2a2ec065","mapPosition":[-921830.125,105217.484],"mimCategory":null,"minZoom":4,"regionId":"skyrim","sources":[{"kind":"esm","mimIndex":null,"plugin":"Sky_Main.esm","recordId":"Dragonstar East, Dunard's House"}],"type":"house"},{"entrances":[{"coordinate":[-849870.312,129978.672],"exteriorCell":[-104,15],"id":"dragonstar-25.05.entrance-16fbba4de1d947e93c25","sourcePlugin":"Sky_Main.esm","sourceRef":"0x00011c75"}],"exteriorCell":[-104,15],"id":"dragonstar-25.05.place-067a4214f6d224395eeb","mapPosition":[-849870.312,129978.672],"mimCategory":null,"minZoom":4,"regionId":"skyrim","sources":[{"kind":"esm","mimIndex":null,"plugin":"Sky_Main.esm","recordId":"Aejoir Cavern"}],"type":"cave"},{"entrances":[{"coordinate":[-832915.688,71477.695],"exteriorCell":[-102,8],"id":"dragonstar-25.05.entrance-dfcc8735fc92afd2ea40","sourcePlugin":"Sky_Main.esm","sourceRef":"0x00013238"}],"exteriorCell":[-102,8],"id":"dragonstar-25.05.place-06d2615d50af2c0de8ed","mapPosition":[-832915.688,71477.695],"mimCategory":null,"minZoom":4,"regionId":"skyrim","sources":[{"kind":"esm","mimIndex":null,"plugin":"Sky_Main.esm","recordId":"Hyyle's Hut"}],"type":"house"},{"entrances":[{"coordinate":[-859146.812,50736.051],"exteriorCell":[-105,6],"id":"dragonstar-25.05.entrance-1a802a7b632535cda1d1","sourcePlugin":"Sky_Main.esm","sourceRef":"0x0002452d"}],"exteriorCell":[-105,6],"id":"dragonstar-25.05.place-077e4e80e7e14cc86b6a","mapPosition":[-859146.812,50736.051],"mimCategory":null,"minZoom":4,"regionId":"skyrim","sources":[{"kind":"esm","mimIndex":null,"plugin":"Sky_Main.esm","recordId":"Karthwasten, Cravvoka's House"}],"type":"house"},{"entrances":[],"exteriorCell":[-114,19],"id":"dragonstar-25.05.place-092797986f52fb46e0d3","mapPosition":[-929792.0,159744.0],"mimCategory":null,"minZoom":2,"regionId":"skyrim","sources":[{"kind":"esm","mimIndex":null,"plugin":"Sky_Main.esm","recordId":"CELL exterior -114,19"}],"type":"landmark"},{"entrances":[{"coordinate":[-929186.812,106334.812],"exteriorCell":[-114,12],"id":"dragonstar-25.05.entrance-5f4c6576fc56c4a230d7","sourcePlugin":"Sky_Main.esm","sourceRef":"0x000485a8"}],"exteriorCell":[-114,12],"id":"dragonstar-25.05.place-092d6dc3451bfdab8482","mapPosition":[-929186.812,106334.812],"mimCategory":null,"minZoom":4,"regionId":"skyrim","sources":[{"kind":"esm","mimIndex":null,"plugin":"Sky_Main.esm","recordId":"Dragonstar West, Crown Reserve Bank"}],"type":"other"},{"entrances":[{"coordinate":[-927426.625,106743.359],"exteriorCell":[-114,13],"id":"dragonstar-25.05.entrance-16ef484e9963876ed8e9","sourcePlugin":"Sky_Main.esm","sourceRef":"0x00048a63"},{"coordinate":[-927947.375,106104.727],"exteriorCell":[-114,12],"id":"dragonstar-25.05.entrance-2568d343e0f2e86c0062","sourcePlugin":"Sky_Main.esm","sourceRef":"0x000485aa"}],"exteriorCell":[-114,13],"id":"dragonstar-25.05.place-0a94a81609d82c5a2c63","mapPosition":[-927426.625,106743.359],"mimCategory":null,"minZoom":4,"regionId":"skyrim","sources":[{"kind":"esm","mimIndex":null,"plugin":"Sky_Main.esm","recordId":"Dragonstar West, Tamisa: Clothier"}],"type":"shop"},{"entrances":[{"coordinate":[-856985.625,46824.16],"exteriorCell":[-105,5],"id":"dragonstar-25.05.entrance-4a81eb32c123aa1810f1","sourcePlugin":"Sky_Main.esm","sourceRef":"0x000005b2"},{"coordinate":[-856996.062,47200.023],"exteriorCell":[-105,5],"id":"dragonstar-25.05.entrance-977381271ca61de691a2","sourcePlugin":"Sky_Main.esm","sourceRef":"0x000005b0"},{"coordinate":[-857543.688,46958.891],"exteriorCell":[-105,5],"id":"dragonstar-25.05.entrance-cf408654e1cb32e30565","sourcePlugin":"Sky_Main.esm","sourceRef":"0x000005cf"}],"exteriorCell":[-105,5],"id":"dragonstar-25.05.place-0bd83ca0ef634602e805","mapPosition":[-856985.625,46824.16],"mimCategory":null,"minZoom":4,"regionId":"skyrim","sources":[{"kind":"esm","mimIndex":null,"plugin":"Sky_Main.esm","recordId":"Karthwasten, Pelbelle's House"}],"type":"house"},{"entrances":[{"coordinate":[-853318.312,43901.422],"exteriorCell":[-105,5],"id":"dragonstar-25.05.entrance-f0f43b3783fc68249e4a","sourcePlugin":"Sky_Main.esm","sourceRef":"0x000005c6"}],"exteriorCell":[-105,5],"id":"dragonstar-25.05.place-0c003f2176628bc98807","mapPosition":[-853318.312,43901.422],"mimCategory":null,"minZoom":4,"regionId":"skyrim","sources":[{"kind":"esm","mimIndex":null,"plugin":"Sky_Main.esm","recordId":"Karthwasten, Bazaar"}],"type":"other"},{"entrances":[{"coordinate":[-853911.938,41701.07],"exteriorCell":[-105,5],"id":"dragonstar-25.05.entrance-2a5e223af75bee4659f1","sourcePlugin":"Sky_Main.esm","sourceRef":"0x000005ad"},{"coordinate":[-852968.375,41964.648],"exteriorCell":[-105,5],"id":"dragonstar-25.05.entrance-37031bd0cdc6f0a0f7e4","sourcePlugin":"Sky_Main.esm","sourceRef":"0x000005ae"},{"coordinate":[-851883.625,41483.766],"exteriorCell":[-104,5],"id":"dragonstar-25.05.entrance-7b3b900ee6dc28959f6d","sourcePlugin":"Sky_Main.esm","sourceRef":"0x00000cb2"}],"exteriorCell":[-105,5],"id":"dragonstar-25.05.place-0c4bf7d39290f49d0aa0","mapPosition":[-852968.375,41964.648],"mimCategory":null,"minZoom":4,"regionId":"skyrim","sources":[{"kind":"esm","mimIndex":null,"plugin":"Sky_Main.esm","recordId":"Karthwasten, Mabon Cestus' House"}],"type":"house"},{"entrances":[{"coordinate":[-831789.375,91901.977],"exteriorCell":[-102,11],"id":"dragonstar-25.05.entrance-1130877bb76e2f9fe25f","sourcePlugin":"Sky_Main.esm","sourceRef":"0x000171ca"},{"coordinate":[-831020.938,92661.664],"exteriorCell":[-102,11],"id":"dragonstar-25.05.entrance-98412c2a1851ddf7f432","sourcePlugin":"Sk